{
  "schema_version": "1.0.0",
  "kind": "presentation-evidence",
  "presentation_id": "presentation_5627f087550dd218",
  "page_id": "page_6666666666666666",
  "status": "approved",
  "authority": "presentation-only",
  "sources": [
    {
      "id": "adaptive-placement-audit",
      "source_kind": "design-brief",
      "purpose": "responsive-layout",
      "snapshot_uri": "docs/architecture/c5-adapt2-audit-placement-multifenetre-2026-09-28.md",
      "media_type": "text/markdown",
      "bytes": 24005,
      "sha256": "2fb5823ce595b5c664c55dcd0923904b18c6664b2018ac059cde4be66770a418",
      "trust": "untrusted-content",
      "state_ids": [],
      "viewport": null
    },
    {
      "id": "progressive-filter-brief",
      "source_kind": "design-brief",
      "purpose": "responsive-layout",
      "snapshot_uri": "examples/users-management-proof/presentation/progressive-filter-candidates/proposal.md",
      "media_type": "text/markdown",
      "bytes": 7820,
      "sha256": "b78274c2d5cc0ada90f05c78b81be6fcdc67ef06b07151e30ec0dc0169fdb969",
      "trust": "untrusted-content",
      "state_ids": [],
      "viewport": null
    },
    {
      "id": "medium-progressive-filter-empty",
      "source_kind": "wireframe",
      "purpose": "responsive-layout",
      "snapshot_uri": "examples/users-management-proof/presentation/progressive-filter-candidates/medium-empty.proposed.png",
      "media_type": "image/png",
      "bytes": 51217,
      "sha256": "a6e2b73b149b06c7090c0d03b2fc02f89aaf0960ec3af13fd924ae746e9e0a01",
      "trust": "untrusted-content",
      "state_ids": ["ready"],
      "viewport": {
        "width": 1024,
        "height": 768,
        "pixel_ratio": 1
      }
    },
    {
      "id": "medium-progressive-filter-one",
      "source_kind": "wireframe",
      "purpose": "responsive-layout",
      "snapshot_uri": "examples/users-management-proof/presentation/progressive-filter-candidates/medium-one-filter.proposed.png",
      "media_type": "image/png",
      "bytes": 59877,
      "sha256": "efc918c2341aafa00d289afc8ec98eacea01b30eb41ef5b492db14eb629d7cbd",
      "trust": "untrusted-content",
      "state_ids": ["ready"],
      "viewport": {
        "width": 1024,
        "height": 768,
        "pixel_ratio": 1
      }
    },
    {
      "id": "medium-progressive-filter-multiple",
      "source_kind": "wireframe",
      "purpose": "responsive-layout",
      "snapshot_uri": "examples/users-management-proof/presentation/progressive-filter-candidates/medium-multiple-filters.proposed.png",
      "media_type": "image/png",
      "bytes": 59512,
      "sha256": "24f4e8829ec742cbf61862cf050a9d96c20b057ba30a39d09116f18ca804dd8c",
      "trust": "untrusted-content",
      "state_ids": ["ready"],
      "viewport": {
        "width": 1024,
        "height": 768,
        "pixel_ratio": 1
      }
    },
    {
      "id": "expanded-progressive-filter-empty",
      "source_kind": "wireframe",
      "purpose": "primary-layout",
      "snapshot_uri": "examples/users-management-proof/presentation/progressive-filter-candidates/expanded-empty.proposed.png",
      "media_type": "image/png",
      "bytes": 68000,
      "sha256": "16a60e4b488dcf8a91eea59bda7606c07c4f4986d99bcd89c69bd10ceee86fd3",
      "trust": "untrusted-content",
      "state_ids": ["ready"],
      "viewport": {
        "width": 1440,
        "height": 1024,
        "pixel_ratio": 1
      }
    },
    {
      "id": "expanded-progressive-filter-one",
      "source_kind": "wireframe",
      "purpose": "responsive-layout",
      "snapshot_uri": "examples/users-management-proof/presentation/progressive-filter-candidates/expanded-one-filter.proposed.png",
      "media_type": "image/png",
      "bytes": 71582,
      "sha256": "a3dadbb9196022d680fb2649ee126a2030f99730e2ace7a7516dd730114725e8",
      "trust": "untrusted-content",
      "state_ids": ["ready"],
      "viewport": {
        "width": 1440,
        "height": 1024,
        "pixel_ratio": 1
      }
    },
    {
      "id": "expanded-progressive-filter-multiple",
      "source_kind": "wireframe",
      "purpose": "responsive-layout",
      "snapshot_uri": "examples/users-management-proof/presentation/progressive-filter-candidates/expanded-multiple-filters.proposed.png",
      "media_type": "image/png",
      "bytes": 71484,
      "sha256": "36143bf636ac40dcf2c03a6d4d55bfe3418d5c869f8a712c118c3003bc6be5a5",
      "trust": "untrusted-content",
      "state_ids": ["ready"],
      "viewport": {
        "width": 1440,
        "height": 1024,
        "pixel_ratio": 1
      }
    }
  ]
}
